{
  "$schema": "https://json-schema.org/draft/2020-12/schema",
  "$id": "https://schemas.kumwe.org/studio/v1/schema-profile-vector.schema.json",
  "title": "Studio property-schema profile conformance vector",
  "description": "One portable admission or instance-validation assertion for studio.profile/schema-property. Rejection vectors deliberately carry schemas outside the profile, so the schema member is bounded JSON rather than a reference to the profile meta-schema.",
  "type": "object",
  "additionalProperties": false,
  "required": ["contractVersion", "kind", "id", "description", "profile", "schema", "expect"],
  "properties": {
    "contractVersion": { "$ref": "common.schema.json#/$defs/contractVersion" },
    "kind": { "const": "schema-profile-vector" },
    "id": { "$ref": "common.schema.json#/$defs/stableId" },
    "description": {
      "type": "string",
      "minLength": 1,
      "maxLength": 500
    },
    "profile": { "const": "studio.profile/schema-property" },
    "boundary": { "$ref": "#/$defs/limitBoundary" },
    "schema": {
      "description": "The candidate schema. This is intentionally unconstrained so invalid-root and unsafe-member vectors remain expressible; the vector file itself remains bounded by the corpus size policy. Values JSON cannot represent are covered by implementation tests."
    },
    "expect": {
      "oneOf": [
        {
          "type": "object",
          "additionalProperties": false,
          "required": ["outcome", "instances"],
          "properties": {
            "outcome": { "const": "accepted" },
            "instances": {
              "type": "array",
              "minItems": 1,
              "maxItems": 50,
              "items": {
                "type": "object",
                "additionalProperties": false,
                "required": ["value", "valid"],
                "properties": {
                  "value": { "$ref": "common.schema.json#/$defs/jsonValue" },
                  "valid": { "type": "boolean" },
                  "diagnostic": { "$ref": "#/$defs/instanceDiagnostic" }
                },
                "allOf": [
                  {
                    "if": { "properties": { "valid": { "const": true } } },
                    "then": { "properties": { "diagnostic": false } },
                    "else": {
                      "required": ["diagnostic"],
                      "properties": {
                        "diagnostic": { "$ref": "#/$defs/instanceDiagnostic" }
                      }
                    }
                  }
                ]
              }
            }
          }
        },
        {
          "type": "object",
          "additionalProperties": false,
          "required": ["outcome", "code", "schemaPath"],
          "properties": {
            "outcome": { "const": "rejected" },
            "code": {
              "enum": [
                "invalid-root",
                "unsupported-keyword",
                "invalid-keyword-value",
                "unsafe-member",
                "limit-exceeded",
                "invalid-reference",
                "recursive-schema"
              ]
            },
            "schemaPath": { "$ref": "#/$defs/jsonPointer" }
          }
        }
      ]
    }
  },
  "$defs": {
    "limitBoundary": {
      "type": "object",
      "additionalProperties": false,
      "required": ["limit", "position", "value"],
      "properties": {
        "limit": {
          "enum": [
            "maxAlternatives",
            "maxDescriptionLength",
            "maxEnumMembers",
            "maxExamples",
            "maxJsonDepth",
            "maxJsonItems",
            "maxJsonProperties",
            "maxObjectKeyLength",
            "maxPropertyNames",
            "maxReferenceLength",
            "maxReferences",
            "maxSchemaBytes",
            "maxSchemaDepth",
            "maxSchemaMapProperties",
            "maxSchemaNodes",
            "maxTitleLength"
          ]
        },
        "position": { "enum": ["at-limit", "over-limit"] },
        "value": { "type": "integer", "minimum": 1 }
      }
    },
    "instanceDiagnostic": {
      "type": "object",
      "additionalProperties": false,
      "required": ["instancePath", "keyword"],
      "properties": {
        "instancePath": { "$ref": "#/$defs/jsonPointer" },
        "keyword": {
          "type": "string",
          "minLength": 1,
          "maxLength": 100,
          "pattern": "^[A-Za-z$][A-Za-z0-9$]*(?![\\s\\S])"
        }
      }
    },
    "jsonPointer": {
      "type": "string",
      "maxLength": 1000,
      "pattern": "^(?:/(?:[^~\\u0000-\\u001F\\u007F]|~[01])*)*(?![\\s\\S])"
    }
  }
}
