{
  "contractVersion": "0.1-draft",
  "kind": "schema-profile-vector",
  "id": "schema-profile/reference-length-limit-boundary",
  "description": "A local reference with exactly the published number of characters remains admissible.",
  "profile": "studio.profile/schema-property",
  "boundary": {
    "limit": "maxReferenceLength",
    "position": "at-limit",
    "value": 500
  },
  "schema": {
    "additionalProperties": false,
    "$defs": {
      "aaaaaaaaaaaaaaaaaaaaaaaaaaaaaaaaaaaaaaaaaaaaaaaaaaaaaaaaaaaaaaaaaaaaaaaaaaaaaaaaaaaaaaaaaaaaaaaaaaaaaaaaaaaaaaaaaaaaaaaaaaaaaaaaaaaaaaaaaaaaaaaaaaaaaaaaaaaaaaaaaaaaaaaaaaaaaaaaaaaaaaaaaaaaaaaaaaaaaaaa": {
        "$defs": {
          "bbbbbbbbbbbbbbbbbbbbbbbbbbbbbbbbbbbbbbbbbbbbbbbbbbbbbbbbbbbbbbbbbbbbbbbbbbbbbbbbbbbbbbbbbbbbbbbbbbbbbbbbbbbbbbbbbbbbbbbbbbbbbbbbbbbbbbbbbbbbbbbbbbbbbbbbbbbbbbbbbbbbbbbbbbbbbbbbbbbbbbbbbbbbbbbbbbbbbbbb": {
            "$defs": {
              "cccccccccccccccccccccccccccccccccccccccccccccccccccccccccccccccccccccccccccccc": {
                "type": "string"
              }
            }
          }
        }
      }
    },
    "properties": {
      "value": {
        "$ref": "#/$defs/aaaaaaaaaaaaaaaaaaaaaaaaaaaaaaaaaaaaaaaaaaaaaaaaaaaaaaaaaaaaaaaaaaaaaaaaaaaaaaaaaaaaaaaaaaaaaaaaaaaaaaaaaaaaaaaaaaaaaaaaaaaaaaaaaaaaaaaaaaaaaaaaaaaaaaaaaaaaaaaaaaaaaaaaaaaaaaaaaaaaaaaaaaaaaaaaaaaaaaaa/$defs/bbbbbbbbbbbbbbbbbbbbbbbbbbbbbbbbbbbbbbbbbbbbbbbbbbbbbbbbbbbbbbbbbbbbbbbbbbbbbbbbbbbbbbbbbbbbbbbbbbbbbbbbbbbbbbbbbbbbbbbbbbbbbbbbbbbbbbbbbbbbbbbbbbbbbbbbbbbbbbbbbbbbbbbbbbbbbbbbbbbbbbbbbbbbbbbbbbbbbbbb/$defs/cccccccccccccccccccccccccccccccccccccccccccccccccccccccccccccccccccccccccccccc"
      }
    },
    "type": "object"
  },
  "expect": {
    "outcome": "accepted",
    "instances": [
      {
        "value": {
          "value": "ok"
        },
        "valid": true
      }
    ]
  }
}
