{
  "contractVersion": "0.1-draft",
  "kind": "schema-profile-vector",
  "id": "schema-profile/alternative-limit-boundary",
  "description": "A composition array with exactly the published number of alternatives remains admissible.",
  "profile": "studio.profile/schema-property",
  "boundary": {
    "limit": "maxAlternatives",
    "position": "at-limit",
    "value": 64
  },
  "schema": {
    "additionalProperties": false,
    "properties": {
      "value": {
        "oneOf": [
          true,
          true,
          true,
          true,
          true,
          true,
          true,
          true,
          true,
          true,
          true,
          true,
          true,
          true,
          true,
          true,
          true,
          true,
          true,
          true,
          true,
          true,
          true,
          true,
          true,
          true,
          true,
          true,
          true,
          true,
          true,
          true,
          true,
          true,
          true,
          true,
          true,
          true,
          true,
          true,
          true,
          true,
          true,
          true,
          true,
          true,
          true,
          true,
          true,
          true,
          true,
          true,
          true,
          true,
          true,
          true,
          true,
          true,
          true,
          true,
          true,
          true,
          true,
          true
        ]
      }
    },
    "type": "object"
  },
  "expect": {
    "outcome": "accepted",
    "instances": [
      {
        "value": {},
        "valid": true
      }
    ]
  }
}
