{
  "contractVersion": "0.1-draft",
  "kind": "schema-profile-vector",
  "id": "schema-profile/decimal-multiple",
  "description": "Decimal multipleOf uses exact canonical base-ten arithmetic instead of binary division or a tolerance.",
  "profile": "studio.profile/schema-property",
  "schema": {
    "type": "object",
    "additionalProperties": false,
    "properties": {
      "amount": {
        "type": "number",
        "multipleOf": 0.01
      }
    }
  },
  "expect": {
    "outcome": "accepted",
    "instances": [
      {
        "value": {
          "amount": 4.02
        },
        "valid": true
      },
      {
        "value": {
          "amount": 0.3
        },
        "valid": true
      },
      {
        "value": {
          "amount": 4.021
        },
        "valid": false,
        "diagnostic": {
          "instancePath": "/amount",
          "keyword": "multipleOf"
        }
      },
      {
        "value": {
          "amount": 0.30000000000000004
        },
        "valid": false,
        "diagnostic": {
          "instancePath": "/amount",
          "keyword": "multipleOf"
        }
      }
    ]
  }
}
